{
  "session_id": "tier/T1B-audit-runtime-20260524",
  "tier": "T1B",
  "branch": "tier/T1B-audit-runtime-20260524",
  "timestamp": "2026-05-24T02:00:00.000Z",
  "score_total": 95,
  "dimensions": {
    "mathematical_purity": {
      "score": 20,
      "max": 20,
      "fixed_point_check": "NOT_APPLICABLE",
      "float_violations": 0,
      "notes": "No production code. Test float violation file created, verified, deleted."
    },
    "sacred_core_integrity": {
      "score": 18,
      "max": 20,
      "violations": [],
      "notes": "L2 raised (rtpConfig.ts boundary via proposal) and resolved by Human. ADR-010 drafted. -2 for L2 event."
    },
    "performance_delta": {
      "score": 20,
      "max": 20,
      "notes": "No production code modified. Zero performance impact."
    },
    "grade_elevation": {
      "score": 12,
      "max": 15,
      "transitions": [],
      "notes": "ADR-010 and docs created at Grade A. No C→B or B→A code file transitions in docs-only session."
    },
    "regression_count": {
      "score": 10,
      "max": 10,
      "bugs_fixed": 0,
      "bugs_introduced": 0,
      "notes": "No regressions. Clean session."
    },
    "tier_gate_progress": {
      "score": 10,
      "max": 10,
      "gates_advanced": ["T1B-PASS"],
      "notes": "All 5 T1B pass gate conditions met. Audit runtime fully operational."
    },
    "evidence_coverage": {
      "score": 3,
      "max": 3,
      "corpus_citations": 0,
      "notes": "Full handoff chain. All 5 task results documented with verification evidence."
    },
    "mcp_utilization": {
      "score": 2,
      "max": 2,
      "mcps_used": ["memory"],
      "mcps_misused": [],
      "notes": "Memory MCP read at PB-2, updated at branch creation, L2 resolution, and ADR-010 drafting."
    }
  },
  "flags": [
    {
      "level": 2,
      "tag": "L2-VIOLATION-RESOLVED",
      "cell": "Governance Auditor",
      "description": "Sacred Core boundary approached by PROPOSAL doc targeting rtpConfig.ts",
      "file_affected": "runs/proposals/PROPOSAL-rtpConfig-variance-20260524.md",
      "resolved": true,
      "resolution": "Human approved direction A — ADR-010 drafted, implementation gated on Monte Carlo (T4)"
    }
  ],
  "escalation_level": 2,
  "verdict": "PASS_PROPOSE_COMMIT",
  "audit_signature": {
    "pathway_deps": [
      "docs/scoring-notes.md",
      "docs/adr/ADR-010-rtp-variance-tightening.md",
      "runs/proposals/PROPOSAL-rtpConfig-variance-20260524.md"
    ],
    "current_grade": "Grade A",
    "entropy_vector": "Low — documentation and ADR only; no production code; Sacred Core boundary approached via proposal (resolved)",
    "fixed_point_check": "NOT_APPLICABLE"
  }
}
